_unit_id,_unit_state,_trusted_judgments,_last_judgment_at,comments,describe_why_this_is_not_annotatable,not_annotatable,not_annotatable:confidence,please_explain_the_revisions_write_na_if_not_annotatable,aligned,id,original,revised
3471075832,finalized,1,6/23/2023 17:56:08,,,,1.0,"- A spelling error was corrected.
- ""has"" was removed because it is redundant. 
- ""life"" was pluralized of the pronoun ""our.""","From the {begining=>beginning} of the century to now , modern technology has changed and {has=>} made our daily {life=>lives} easier .",fce_test_289,"From the begining of the century to now , modern technology has changed and has made our daily life easier .","From the beginning of the century to now , modern technology has changed and made our daily lives easier ."
3471075833,finalized,1,6/23/2023 13:25:25,,,,1.0,-This edit substitutes a more natural sounding prepositional phrase for this context.,It would be meaningful {in my life=>for me} to take part in your camp .,fce_test_772,It would be meaningful in my life to take part in your camp .,It would be meaningful for me to take part in your camp .
3471075834,finalized,1,6/22/2023 18:42:58,,"""the"" is used to clarify which journalists and removing it changes the meaning",not_annotatable,1.0,,That fact should be respected by {the=>} journalists .,fce_dev_621,That fact should be respected by the journalists .,That fact should be respected by journalists .
3471075835,finalized,1,6/22/2023 16:38:19,,,,1.0,-This is a style edit that simplifies the phrase's structure.,I was excited {that I had=>to get} a closer look at so many famous pop stars .,fce_test_348,I was excited that I had a closer look at so many famous pop stars .,I was excited to get a closer look at so many famous pop stars .
3471075836,finalized,1,6/22/2023 20:05:47,,,,1.0,- The period was put inside the quotations to follow certain style guides.,"There is no objective "" per se {"" .=>.""}",wiki_test_325,"There is no objective "" per se "" .","There is no objective "" per se ."""
3471075837,finalized,1,6/22/2023 16:21:12,,,,1.0,"- ""main line"" was changed to ""mainline"" which is the correct spelling for American English.",The nearest local airport and {main line=>mainline} train station are located at Wick and Thurso .,wiki_test_29,The nearest local airport and main line train station are located at Wick and Thurso .,The nearest local airport and mainline train station are located at Wick and Thurso .
3471075838,finalized,1,6/22/2023 20:04:16,,"""should"" does not mean the same as ""would,"" and this seems more like a style change rather than a GEC change.",not_annotatable,1.0,,"I have a baby and three dogs , so {it should=>log cabins would} be better {in log cabins=>} .",fce_dev_433,"I have a baby and three dogs , so it should be better in log cabins .","I have a baby and three dogs , so log cabins would be better ."
3471075840,finalized,1,6/22/2023 16:12:45,,This edit is meaning changing.,not_annotatable,1.0,-Incorrect: meaning changing,It is {to be=>} operated by the Toronto Transit Commission .,wiki_dev_821,It is to be operated by the Toronto Transit Commission .,It is operated by the Toronto Transit Commission .
3471075841,finalized,1,6/23/2023 14:27:07,,,,1.0,-A comma is inserted here because the two adjectives are interchangeable in terms of order.,"Adelaide has a hot Mediterranean climate ( Köppen climate classification "" Csa "" ) , which generally means mild {=>,} wet winters and hot , dry summers .",wiki_dev_165,"Adelaide has a hot Mediterranean climate ( Köppen climate classification "" Csa "" ) , which generally means mild wet winters and hot , dry summers .","Adelaide has a hot Mediterranean climate ( Köppen climate classification "" Csa "" ) , which generally means mild , wet winters and hot , dry summers ."
3471075842,finalized,1,6/22/2023 20:49:45,,these are not two independent clauses so the comma is incorrect,not_annotatable,1.0,,"The two return to find the Dark Mark over Hogwarts {=>,} and Death Eaters attacking students and teachers .",wiki_test_841,The two return to find the Dark Mark over Hogwarts and Death Eaters attacking students and teachers .,"The two return to find the Dark Mark over Hogwarts , and Death Eaters attacking students and teachers ."
3471075844,finalized,1,6/23/2023 12:10:38,,,,1.0,"-This word shouldn't be capitalized in this context.
-This edit inserted an Oxford comma.","Similar standards exist for automotive ( ISO 26262 ) , {Medical=>medical} ( IEC 62304 ) {=>,} and nuclear ( IEC 61513 ) {=>industries} .",wiki_test_196,"Similar standards exist for automotive ( ISO 26262 ) , Medical ( IEC 62304 ) and nuclear ( IEC 61513 ) .","Similar standards exist for automotive ( ISO 26262 ) , medical ( IEC 62304 ) , and nuclear ( IEC 61513 ) industries ."
3471075850,finalized,1,6/23/2023 17:41:00,,This looks meaning changing to me?,not_annotatable,1.0,,"After two seasons as a minor league coach , Foster became bullpen coach for the Florida Marlins from {=>2007} - {=>2009} , moving briefly into the pitching coach job toward the end of the 2007 season .",wiki_test_267,"After two seasons as a minor league coach , Foster became bullpen coach for the Florida Marlins from - , moving briefly into the pitching coach job toward the end of the 2007 season .","After two seasons as a minor league coach , Foster became bullpen coach for the Florida Marlins from 2007 - 2009 , moving briefly into the pitching coach job toward the end of the 2007 season ."
3471075851,finalized,1,6/22/2023 14:03:32,,,,1.0,-The correct spelling is 'companion.',They are envious and jealous of your {compnion=>companion} .,wiki_dev_473,They are envious and jealous of your compnion .,They are envious and jealous of your companion .
3471075852,finalized,1,6/23/2023 17:10:50,,,,1.0,"- ""with"" is more grammatical than ""having.""
- A comma was added before a relative clause.","Originally built with three operational units {having=>with} a design rating of 660MW MCR ( Maximum Continuous Rating ) , this was increased to 685MW during commissioning with practically no additional engineering works required {=>,} which is testament to the robust design standards rigorously upheld by the CEGB .",wiki_dev_913,"Originally built with three operational units having a design rating of 660MW MCR ( Maximum Continuous Rating ) , this was increased to 685MW during commissioning with practically no additional engineering works required which is testament to the robust design standards rigorously upheld by the CEGB .","Originally built with three operational units with a design rating of 660MW MCR ( Maximum Continuous Rating ) , this was increased to 685MW during commissioning with practically no additional engineering works required , which is testament to the robust design standards rigorously upheld by the CEGB ."
3471075853,finalized,1,6/22/2023 20:50:38,,,,1.0,"- The comma was added before the conjunction ""and"" that is used to conjoin the two independent clauses.","The music video was released on November 12 , 2009 {=>,} and the song was made available for download in the iTunes Store on December 1 , 2009 .",wiki_dev_742,"The music video was released on November 12 , 2009 and the song was made available for download in the iTunes Store on December 1 , 2009 .","The music video was released on November 12 , 2009 , and the song was made available for download in the iTunes Store on December 1 , 2009 ."
3471075854,finalized,1,6/23/2023 16:40:40,,,,1.0,"- Commas were added around the noun phrase ""Dean B. Zelinsky"" because it provides more information about the noun phrase ""the founder.""","After nearly ten years of production , the founder {=>,} Dean B. Zelinsky {=>,} decided that he no longer wanted to manufacture guitars and sold the company .",wiki_dev_586,"After nearly ten years of production , the founder Dean B. Zelinsky decided that he no longer wanted to manufacture guitars and sold the company .","After nearly ten years of production , the founder , Dean B. Zelinsky , decided that he no longer wanted to manufacture guitars and sold the company ."
3471075855,finalized,1,6/22/2023 16:48:26,,,,1.0,"-This edit corrects this participle to an adjective, 'bothersome.'","For the handicapped , going shopping is not easy and it can be very {bothering=>bothersome} unless shops have facilities for them .",fce_dev_360,"For the handicapped , going shopping is not easy and it can be very bothering unless shops have facilities for them .","For the handicapped , going shopping is not easy and it can be very bothersome unless shops have facilities for them ."
3471075857,finalized,1,6/23/2023 13:23:47,,,,1.0,"-'An' is the correct article here because eighteen begins with a vowel sound.
-This comma should not be used here because what follows is a dependent clause.
-This word should not be hyphenated.","The interior 's focal point is {a=>an} 18 ' or 5.5m rose window with flowing tracery , designed by Hugh Easton ( 1906-65 ) {,=>} and situated at the {east-end=>east end} above the high altar .",wiki_dev_809,"The interior 's focal point is a 18 ' or 5.5m rose window with flowing tracery , designed by Hugh Easton ( 1906-65 ) , and situated at the east-end above the high altar .","The interior 's focal point is an 18 ' or 5.5m rose window with flowing tracery , designed by Hugh Easton ( 1906-65 ) and situated at the east end above the high altar ."
3471075858,finalized,1,6/23/2023 12:19:08,,,,1.0,"-Because the  following word does not begin with a vowel sound, 'a' is the correct form of the article here.
-Because the phrase being punctuated here is parenthetical, it is set off with commas.","Ray Stantz owns {an=>a} science / occult book shop in Manhattan , {and=>and,} along with Winston {Zeddmore=>Zeddmore,} they put on special appearances at children 's birthday parties .",wiki_test_769,"Ray Stantz owns an science / occult book shop in Manhattan , and along with Winston Zeddmore they put on special appearances at children 's birthday parties .","Ray Stantz owns a science / occult book shop in Manhattan , and, along with Winston Zeddmore, they put on special appearances at children 's birthday parties ."
3471075859,finalized,1,6/23/2023 13:19:02,,,,1.0,"-This proper noun should be capitalized.
-'The' shouldn't be here because 'Tezpur University' is a proper noun.
-This edit deletes the ungrammatical 'for' and inserts a comma because what follows is a nonrestrictive clause.
-The noun here needs an article or to be plural.
-The correct preposition here  is 'to' instead of 'with.'
-There shouldn't be a space between the last word in the sentence and the period.","The {department=>Department} of Civil Engineering of {the=>} Tezpur University was established in the year 2009 under the School of {Engineering for=>Engineering,} offering {=>a} B.Tech Degree {with=>to} 16 {students .=>students.}",wiki_dev_104,The department of Civil Engineering of the Tezpur University was established in the year 2009 under the School of Engineering for offering B.Tech Degree with 16 students .,"The Department of Civil Engineering of Tezpur University was established in the year 2009 under the School of Engineering, offering a B.Tech Degree to 16 students."
